"QTKNJUEG","journalArticle","2024","Panne, Laura; Hübner, Julia","Phraseologie im historischen Fremdsprachenerwerb. Vermittlung und Übersetzung von Idiomen in der Frühen Neuzeit","Korpora Deutsch als Fremdsprache","","2749-4411","10.48694/KORDAF.3990","https://kordaf.tujournals.ulb.tu-darmstadt.de/article/id/3990/","Phraseologismen in Deutsch als Fremdsprache sind ein Gebiet, dessen Erforschung sowohl in der Fremdsprachendidaktik als auch in der Phraseologie unerlässlich ist. Historische Perspektiven auf die Vermittlung phraseologischer Einheiten und von Idiomen im Speziellen gibt es im DaF-Kontext bislang kaum (vgl. Lang 2010). Vor dem Hintergrund, dass bereits in der Frühen Neuzeit Fremdsprachen rege unterrichtet werden, unter anderem anhand der sogenannten Fremdsprachenlehrwerke, wird dieser Beitrag anhand eines Textkorpus dieser Quelle untersuchen, wie Phraseologismen und deren Vermittlung bzw. Übersetzung einerseits metasprachlich thematisiert und andererseits in Phrasem-Listen und Musterdialogen behandelt werden. Idioms in German as a foreign language are an essential area of research in both foreign language didactics and phraseology. The historical perspective on the teaching of phraseological units and idioms in particular has received little attention so far (cf. Lang 2010). Due to the fact that foreign languages were already been actively taught in the early modern period (e.g., by means of foreign language textbooks), this article will use a text corpus of early-modern textbooks to examine how idioms were taught and translated as well as how they were addressed meta-linguistically on the one hand and treated in phraseme lists and sample dialogues on the other.","2024","2026-06-04 09:33:45","2026-06-04T09:33:45Z","2025-08-25 13:06:34","102–122","","1","4","","","","","","","","","","","","","","","DOI.org (Datacite)","","","","","","","Deutsch als Fremdsprache; German as a foreign language; Historische Mehrsprachigkeit; historical foreign language acquisition; historical language teaching; historical multilingualism; historical phraseology; historische Phraseologie; historische Sprachvermittlung; historischer Fremdspracherwerb","","","","","","","","","","","","","","","","","","","","","","","","","","","","","","","","","","","","","","","","","","","","","",""
"PWRPD3AZ","bookSection","2025","Panne, Laura","Textmuster mehrsprachiger Ausspracheanweisungen in Sprachbüchern aus dem 16. bis 18. Jahrhundert","Zur Geschichte von Textsorten. Textmuster vom 8. bis zum 18. Jahrhundert. Akten zum internationalen Kongress vom 15. bis 17. Juni 2023 an der Rheinischen Friedrich-Wilhelms-Universität Bonn","978-3-89693-807-7","","","","","2025","2026-06-04 09:32:31","2026-06-04T09:32:31Z","","307-334","","","","","","","Berliner Sprachwissenschaftliche Studien","42","","","Weidler","Berlin","ger","","","","","Open WorldCat","","OCLC: 1542837783","","","","","","Wich-Reif, Claudia","","","","","","","","","","","","","","","","","","","","","","","","","","","","","","","","","","","","","","","","","","","","",""
"WMUAHMUN","bookSection","2024","Newerkla, Stefan Michael","Das zehnsprachige <i>Gazophylacium</i> (1691) des Christoph Warmer aus der königlichen Freistadt Košice (Kaschau, Kassa) als Sprachführer für Kaufleute","Die Sprachen des Handels","978-3-98989-035-0","","10.20378/irb-98527","https://fis.uni-bamberg.de/handle/uniba/98527","","2024","2026-06-04 09:06:57","2026-06-04T09:06:57Z","2025-09-17 12:52:07","67-85","","","","","","","Schriften der Matthias-Kramer-Gesellschaft zur Erforschung der Geschichte des Fremdsprachenerwerbs und der Mehrsprachigkeit","5","","","University of Bamberg Press","Bamberg","","","","","","DOI.org (Crossref)","","","","","","","","Daunorienė, Justina; Häberlein, Mark","","","","","","","","","","","","","","","","","","","","","","","","","","","","","","","","","","","","","","","","","","","","",""
"26WI2CZN","journalArticle","2025","Koch, Emma","Fragments of an Early <i>Vocabulare</i> Edition. A missing link in the evolution of the Barlaimont conversation books","Quaerendo","","","","","","2025","2026-06-03 15:46:00","2026-06-03T15:46:00Z","","159–178","","2","55","","","","","","","","","","","","","","","","","","","","","","","","","","","","","","","","","","","","","","","","","","","","","","","","","","","","","","","","","","","","","","","","","","","",""
"XTMKTAGH","journalArticle","2026","Hübner, Julia; Roth, Kerstin","Was ist eigentlich <i>normal</i>? Sprachhistorische Perspektiven auf ein vielschichtiges Konzept","Zeitschrift für Literaturwissenschaft und Linguistik","","","https://doi.org/10.1007/s41244-026-00424-6","","","2026","2026-06-03 15:28:23","2026-06-03T15:28:23Z","","","","2","56","","","","","","","","","","","","","","","","","","","","","","","","","","","","","","","","","","","","","","","","","","","","","","","","","","","","","","","","","","","","","","","","","","","",""
"RZJ24KDR","bookSection","2026","Gennies, Linda","Politeness Rewritten: Tracing Address Variation in Early Modern Multilingual Foreign Language Manuals","Politeness Crossing Times and Spaces","978-3-447-12551-2","","10.13173/9783447125512.099","https://www.harrassowitz-verlag.de/isbn_9783447125512.ahtml","","2026","2026-06-03 15:11:00","2026-06-03T15:11:00Z","2026-05-05 10:19:10","99-122","","","","","","Politeness Rewritten","Episteme in Bewegung","44","","","Harrassowitz","Wiesbaden","","","","","","DOI.org (Crossref)","","","","","","","","Gennies, Linda; Simon, Horst J.","","","","","","","","","","","","","","","","","","","","","","","","","","","","","","","","","","","","","","","","","","","","",""
"N5939G9V","bookSection","2025","Filatkina, Natalia","Fremdsprachenlehrwerke aus der Frühen Neuzeit als Textmuster – Textmuster in den Fremdsprachenlehrwerken","Zur Geschichte von Textsorten. Textmuster vom 8. bis zum 18. Jahrhundert. Akten zum internationalen Kongress vom 15. bis 17. Juni 2023 an der Rheinischen Friedrich-Wilhelms-Universität Bonn","978-3-89693-807-7","","","","","2025","2026-06-03 14:58:42","2026-06-03T14:58:42Z","","335-359","","","","","","","Berliner Sprachwissenschaftliche Studien","42","","","Weidler","Berlin","ger","","","","","Open WorldCat","","OCLC: 1542837783","","","","","","Wich-Reif, Claudia","","","","","","","","","","","","","","","","","","","","","","","","","","","","","","","","","","","","","","","","","","","","",""
"BBFFNNM6","bookSection","2025","Baddeley, Susan","Les «Berlaimonts». Anatomie d’un phénomène éditorial européen de la période moderne","Polyhistor Europaeus: Études sur l’âge classique offertes à Chantal Grell","978-2-503-60995-9 978-2-503-60996-6","","10.1484/M.DDA-EB.5.135873","https://www.brepolsonline.net/doi/book/10.1484/M.DDA-EB.5.135873","","2025","2026-06-03 14:24:59","2026-06-03T14:24:59Z","2025-08-27 18:40:20","557-576","","","","","","","De Diversis Artibus","112","","","Brepols","Turnhout, Belgium","fr","","","","","DOI.org (Crossref)","","","","","","","","Da Vinha, Mathieu; El Gammal, Blanche; Forycki, Maciej; Zuili, Marc","","","","","","","","","","","","","","","","","","","","","","","","","","","","","","","","","","","","","","","","","","","","",""
"B9XZPHPJ","book","2024","","Die Sprachen des Handels","","978-3-98989-035-0","","10.20378/irb-98527","https://fis.uni-bamberg.de/handle/uniba/98527","Neben Diplomatie, Reisen, Mission und großräumiger Migration gehört der Fernhandel zu denjenigen sozialen Feldern, auf denen die Notwendigkeit, über Sprachgrenzen hinweg zu kommunizieren, im Laufe der Jahrhunderte besonders groß war. In der Geschichte des mittelalterlichen und neuzeitlichen Fernhandels spielen Fragen der Verständigung zwischen Kaufleuten aus unterschiedlichen Sprachräumen daher eine große Rolle. Der vorliegende Band behandelt Lernstrategien und Kommunikationsprozesse im kaufmännischen Milieu und stellt eine Reihe von Lehrwerken vor, auf die Kaufleute und ihre Angestellten beim Erlernen fremder Sprachen zurückgreifen konnten.","2024","2026-05-26 15:51:03","2026-05-26T15:51:03Z","2025-09-17 12:52:07","","","","","","","","Schriften der Matthias-Kramer-Gesellschaft zur Erforschung der Geschichte des Fremdsprachenerwerbs und der Mehrsprachigkeit","5","","","University of Bamberg Press","Bamberg","","","","","","DOI.org (Crossref)","","","","","","","","Daunorienė, Justina; Häberlein, Mark","","","","","","","","","","","","","","","","","","","","","","","","","","","","","","","","","","","","","","","","","","","","",""
"U39UADWW","journalArticle","2025","Haar, Alisa van de","Visible masters and invisible students? Educational translation in the early modern Low Countries","Perspectives","","0907-676X, 1747-6623","10.1080/0907676X.2024.2421771","https://www.tandfonline.com/doi/full/10.1080/0907676X.2024.2421771","","2025-03-04","2026-03-06 12:44:22","2026-03-06T12:44:22Z","2025-09-22 16:06:26","245-259","","2","33","","Perspectives","Visible masters and invisible students?","","","","","","","en","","","","","DOI.org (Crossref)","","","","","","","","","","","","","","","","","","","","","","","","","","","","","","","","","","","","","","","","","","","","","","","","","","","","",""
"WW7Z9MS9","journalArticle","2024","Gallagher, John","Teaching Europe French: the worlds and words of Claude Mauger","Early Modern French Studies","","2056-3035, 2056-3043","10.1080/20563035.2024.2418036","https://www.tandfonline.com/doi/full/10.1080/20563035.2024.2418036","","2024-07-02","2026-03-06 12:44:16","2026-03-06T12:44:16Z","2025-10-08 11:24:06","122-149","","2","46","","Early Modern French Studies","Teaching Europe French","","","","","","","en","","","","","DOI.org (Crossref)","","","","","","","","","","","","","","","","","","","","","","","","","","","","","","","","","","","","","","","","","","","","","","","","","","","","",""
"G9U2BWDW","journalArticle","2025","Tsapaeva, Sabina","Übersetzungstransformationen und die Motivation(en) dahinter: Eine exemplarische Analyse am Beispiel des anonymen Gesprächsbuchs „Ein Rusch Boeck“ aus dem 16. Jh.","Korrespondenzblatt des Vereins für niederdeutsche Sprachforschung","","","","","","2025","2025-08-14 09:19:35","2025-08-14T09:19:35Z","","50–68","","","132","","","","","","","","","","","","","","","","","","","","","","","","","","","","","","","","","","","","","","","","","","","","","","","","","","","","","","","","","","","","","","","","","","","",""
"JLG2PCVP","journalArticle","2023","Hüning, Matthias; Vogl, Ulrike","Hoe ‘Sprachmeister’ vreemde talen ‘maken’: De conceptualisering van vreemde talen en meertaligheid in vroegmoderne taalmethodes","Tijdschrift voor Nederlandse Taal- en Letterkunde","","0040-7550, 2212-0521","10.5117/TNTL2023.2/3.005.HUNI","https://www.aup-online.com/content/journals/10.5117/TNTL2023.2/3.005.HUNI","","2023-08-01","2025-02-17 13:09:32","2025-02-17T13:09:32Z","2025-02-17 13:09:31","201-219","","2/3","139","","","Hoe ‘Sprachmeister’ vreemde talen ‘maken’","","","","","","","nl","","","","","DOI.org (Crossref)","","","","","","","","","","","","","","","","","","","","","","","","","","","","","","","","","","","","","","","","","","","","","","","","","","","","",""