"Key","Item Type","Publication Year","Author","Title","Publication Title","ISBN","ISSN","DOI","Url","Abstract Note","Date","Date Added","Date Modified","Access Date","Pages","Num Pages","Issue","Volume","Number Of Volumes","Journal Abbreviation","Short Title","Series","Series Number","Series Text","Series Title","Publisher","Place","Language","Rights","Type","Archive","Archive Location","Library Catalog","Call Number","Extra","Notes","File Attachments","Link Attachments","Manual Tags","Automatic Tags","Editor","Series Editor","Translator","Contributor","Attorney Agent","Book Author","Cast Member","Commenter","Composer","Cosponsor","Counsel","Interviewer","Producer","Recipient","Reviewed Author","Scriptwriter","Words By","Guest","Number","Edition","Running Time","Scale","Medium","Artwork Size","Filing Date","Application Number","Assignee","Issuing Authority","Country","Meeting Name","Conference Name","Court","References","Reporter","Legal Status","Priority Numbers","Programming Language","Version","System","Code","Code Number","Section","Session","Committee","History","Legislative Body"
"BCXNXV9G","bookSection","2024","Gennies, Linda","Handlungswissen und Strukturwissen in frühneuzeitlichen Sprachbüchern","Logbuch Wissensgeschichte","978-3-447-12180-4 978-3-447-39520-5","","10.13173/9783447121804","","","2024","2026-06-16 07:39:08","2026-06-16T07:39:08Z","","131-148","","","","","","","Episteme in Bewegung","36","","","Harrassowitz","Wiesbaden","ger","","","","","K10plus ISBN","","","","","","","","Becker-Sawatzky, Mira; Dadaş, Şirin; Eusterschulte, Anne; Hasselmann, Kristiane; Johnston, Andrew James; Quenstedt, Falk; Reufer, Claudia; Trauer, Hanna Zoe; Vogel, Christian; Wächter, Katrin; Wendt, Helge","","","","","","","","","","","","","","","","","","","","","","","","","","","","","","","","","","","","","","","","","","","","",""
"3P5Q6WGC","book","2025","","Historiographie linguistique et enseignement de l'espagnol en France (XVIe - XVIIIe siècle). Du livre ancien aux humanités numériques","","978-2-36783-434-4","","","","","2025","2026-06-16 07:37:14","2026-06-16T07:37:14Z","","","","","","","","","Culture et Numérique","5","","","Éditions Orbis Tertius","","fre","","","","","","","","","","","","","Maux, Marie-Hélène; Richer-Rossi, Françoise; Zuili, Marc","","","","","","","","","","","","","","","","","","","","","","","","","","","","","","","","","","","","","","","","","","","","",""
"4MUCIUY4","bookSection","2026","Büchler, Liv; Simon, Horst J.","Historische Fremdsprachenlehrwerke genau lesen: Quellen, Methoden, Perspektiven","Fremdsprachenlehrwerke im 17. Jahrhundert. Beiträge zu einem Linguistic Close Reading","978-3-447-12549-9","","","","","2026","2026-06-09 19:13:25","2026-06-09T19:13:25Z","","1-14","","","","","","","Episteme in Bewegung","46","","","Harrassowitz","Wiesbaden","","","","","","","","","","","","","","Büchler, Liv; Simon, Horst J.","","","","","","","","","","","","","","","","","","","","","","","","","","","","","","","","","","","","","","","","","","","","",""
"2C7683XA","bookSection","2026","Dammel, Antje","<i>O mein Gott / was verziecht ihr so lang?</i> Pragmatische Marker und sequenzielle Muster in drei frühneuzeitlichen Sprachlehrwerken","Fremdsprachenlehrwerke im 17. Jahrhundert. Beiträge zu einem Linguistic Close Reading","","","","","","2026","2026-06-09 19:12:01","2026-06-09T19:12:01Z","","127-158","","","","","","","Episteme in Bewegung","46","","","Harrassowitz","Wiesbaden","","","","","","","","","","","","","","Büchler, Liv; Simon, Horst J.","","","","","","","","","","","","","","","","","","","","","","","","","","","","","","","","","","","","","","","","","","","","",""
"JHLK78CZ","bookSection","2026","Imo, Wolfgang","""Unflat / der du bist / sichst nit / daß alles feicht ist“ – Vorwurfssequenzen in Lehrwerken der Frühen Neuzeit","Fremdsprachenlehrwerke im 17. Jahrhundert. Beiträge zu einem Linguistic Close Reading","","","","","","2026","2026-06-09 19:12:01","2026-06-09T19:12:01Z","","179-200","","","","","","","Episteme in Bewegung","46","","","Harrassowitz","Wiesbaden","","","","","","","","","","","","","","Büchler, Liv; Simon, Horst J.","","","","","","","","","","","","","","","","","","","","","","","","","","","","","","","","","","","","","","","","","","","","",""
"AD7UB24C","bookSection","2026","Scharinger, Thomas","Fremdsprachenlehrwerke als Quelle zur Erforschung historischer Sprachkontaktsituationen am Beispiel des Französischen im deutschsprachigen Raum des 17. und 18. Jahrhunderts","Fremdsprachenlehrwerke im 17. Jahrhundert. Beiträge zu einem Linguistic Close Reading","","","","","","2026","2026-06-09 19:12:01","2026-06-09T19:12:01Z","","203-227","","","","","","","Episteme in Bewegung","46","","","Harrassowitz","Wiesbaden","","","","","","","","","","","","","","Büchler, Liv; Simon, Horst J.","","","","","","","","","","","","","","","","","","","","","","","","","","","","","","","","","","","","","","","","","","","","",""
"CWSI2WZA","bookSection","2026","Corvo Sánchez, María José","Von <i>Tyrocinium </i>(1617) bis zu <i>Das Newe Sprachbuch </i>(1621): die neue Methode von Juan Ángel de Zumaran (fl. 1617−1636)","Fremdsprachenlehrwerke im 17. Jahrhundert. Beiträge zu einem Linguistic Close Reading","","","","","","2026","2026-06-09 19:12:01","2026-06-09T19:12:01Z","","305-327","","","","","","","Episteme in Bewegung","46","","","Harrassowitz","Wiesbaden","","","","","","","","","","","","","","Büchler, Liv; Simon, Horst J.","","","","","","","","","","","","","","","","","","","","","","","","","","","","","","","","","","","","","","","","","","","","",""
"HPBLEHER","bookSection","2026","Hübner, Julia","Zwischen tugendsamer Frau und Ehebrecherin. Frauen in historischen Fremdsprachenlehrwerken","Fremdsprachenlehrwerke im 17. Jahrhundert. Beiträge zu einem Linguistic Close Reading","","","","","","2026","2026-06-09 19:12:01","2026-06-09T19:12:01Z","","329-345","","","","","","","Episteme in Bewegung","46","","","Harrassowitz","Wiesbaden","","","","","","","","","","","","","","Büchler, Liv; Simon, Horst J.","","","","","","","","","","","","","","","","","","","","","","","","","","","","","","","","","","","","","","","","","","","","",""
"7D85R68X","bookSection","2026","Haßler, Gerda","Konzepte des Sprachdenkens in Sprachlehrwerken","Fremdsprachenlehrwerke im 17. Jahrhundert. Beiträge zu einem Linguistic Close Reading","","","","","","2026","2026-06-09 19:12:01","2026-06-09T19:12:01Z","","347-366","","","","","","","Episteme in Bewegung","46","","","Harrassowitz","Wiesbaden","","","","","","","","","","","","","","Büchler, Liv; Simon, Horst J.","","","","","","","","","","","","","","","","","","","","","","","","","","","","","","","","","","","","","","","","","","","","",""
"67QUVHCM","bookSection","2026","Moulin, Claudine","Permeabilität und Wandlung – Pierre Canel, <i>Königliche Teutsche Grammatic </i>(Nürnberg 1689)","Fremdsprachenlehrwerke im 17. Jahrhundert. Beiträge zu einem Linguistic Close Reading","","","","","","2026","2026-06-09 19:12:01","2026-06-09T19:12:01Z","","367-393","","","","","","","Episteme in Bewegung","46","","","Harrassowitz","Wiesbaden","","","","","","","","","","","","","","Büchler, Liv; Simon, Horst J.","","","","","","","","","","","","","","","","","","","","","","","","","","","","","","","","","","","","","","","","","","","","",""
"VVUP53GN","bookSection","2026","Fleischer, Jürg","Der Wert von Canels <i>Königlicher Teutscher Grammatic </i>(Nürnberg 1689) als Quelle für die historische Morphosyntax des Deutschen: Ergebnisse eines Close Reading","Fremdsprachenlehrwerke im 17. Jahrhundert. Beiträge zu einem Linguistic Close Reading","","","","","","2026","2026-06-09 19:12:01","2026-06-09T19:12:01Z","","49-69","","","","","","","Episteme in Bewegung","46","","","Harrassowitz","Wiesbaden","","","","","","","","","","","","","","Büchler, Liv; Simon, Horst J.","","","","","","","","","","","","","","","","","","","","","","","","","","","","","","","","","","","","","","","","","","","","",""
"RWW86BXH","bookSection","2026","Freywald, Ulrike","Frühneuhochdeutsche Syntax und konzeptionelle Mündlichkeit in zwei Fremdsprachenlehrwerken des 17. Jahrhunderts","Fremdsprachenlehrwerke im 17. Jahrhundert. Beiträge zu einem Linguistic Close Reading","","","","","","2026","2026-06-09 19:12:01","2026-06-09T19:12:01Z","","71-99","","","","","","","Episteme in Bewegung","46","","","Harrassowitz","Wiesbaden","","","","","","","","","","","","","","Büchler, Liv; Simon, Horst J.","","","","","","","","","","","","","","","","","","","","","","","","","","","","","","","","","","","","","","","","","","","","",""
"V5XDLMWT","bookSection","2026","Büchler, Liv","Referenzielle Funktionen des Pronomens <i>man</i> in historischen Fremdsprachenlehrwerken – Potenziale eines Close Reading","Fremdsprachenlehrwerke im 17. Jahrhundert. Beiträge zu einem Linguistic Close Reading","","","","","","2026","2026-06-09 19:12:01","2026-06-09T19:12:01Z","","101-125","","","","","","","Episteme in Bewegung","46","","","Harrassowitz","Wiesbaden","","","","","","","","","","","","","","Büchler, Liv; Simon, Horst J.","","","","","","","","","","","","","","","","","","","","","","","","","","","","","","","","","","","","","","","","","","","","",""
"VR5S9FRZ","bookSection","2026","Schrott, Angela","Das <i>Newe Sprachbuch</i> des Juan Angel de Sumaran aus der Perspektive der historischen Gesprächsforschung","Fremdsprachenlehrwerke im 17. Jahrhundert. Beiträge zu einem Linguistic Close Reading","","","","","","2026","2026-06-09 19:12:01","2026-06-09T19:12:01Z","","159-177","","","","","","","Episteme in Bewegung","46","","","Harrassowitz","Wiesbaden","","","","","","","","","","","","","","Büchler, Liv; Simon, Horst J.","","","","","","","","","","","","","","","","","","","","","","","","","","","","","","","","","","","","","","","","","","","","",""
"UHCX3DD8","bookSection","2026","Vogl, Ulrike","Der Fremdsprachenlehrer als Native Speaker, Didaktikexperte oder Grammatikkenner? Veränderte Autoritätsansprüche vor dem Hintergrund des Aufkommens der Standardsprachenideologie","Fremdsprachenlehrwerke im 17. Jahrhundert. Beiträge zu einem Linguistic Close Reading","","","","","","2026","2026-06-09 19:12:01","2026-06-09T19:12:01Z","","249-265","","","","","","","Episteme in Bewegung","46","","","Harrassowitz","Wiesbaden","","","","","","","","","","","","","","Büchler, Liv; Simon, Horst J.","","","","","","","","","","","","","","","","","","","","","","","","","","","","","","","","","","","","","","","","","","","","",""
"V5JPZMUY","bookSection","2026","Masiero, Federica","Formen des Sprachvergleichs in Fremdsprachenlehrwerken aus dem 17. Jahrhundert","Fremdsprachenlehrwerke im 17. Jahrhundert. Beiträge zu einem Linguistic Close Reading","","","","","","2026","2026-06-09 19:12:01","2026-06-09T19:12:01Z","","267-285","","","","","","","Episteme in Bewegung","46","","","Harrassowitz","Wiesbaden","","","","","","","","","","","","","","Büchler, Liv; Simon, Horst J.","","","","","","","","","","","","","","","","","","","","","","","","","","","","","","","","","","","","","","","","","","","","",""
"UFDQURD8","bookSection","2026","Patrukhina, Liubov","Lehrwerke des 17. Jahrhunderts aus Perspektive der gegenwärtigen Fremdsprachendidaktik: Vermittlung von Lexik und Pragmatik im deutsch-französischen Vergleich. Linguistic Close Reading des ersten Dialogs in <i>Das Newe Sprachbuch </i>(1621) von Juan Ángel de Sumaran","Fremdsprachenlehrwerke im 17. Jahrhundert. Beiträge zu einem Linguistic Close Reading","","","","","","2026","2026-06-09 19:12:01","2026-06-09T19:12:01Z","","288-303","","","","","","","Episteme in Bewegung","46","","","Harrassowitz","Wiesbaden","","","","","","","","","","","","","","Büchler, Liv; Simon, Horst J.","","","","","","","","","","","","","","","","","","","","","","","","","","","","","","","","","","","","","","","","","","","","",""
"VFQ4IHPR","bookSection","2026","McLelland, Nicola","<i>Language Making </i>in DaF-Werken für Englisch- und Französischsprachige im späten 17. Jahrhundert? Martin Aedlers <i>High Dutch Minerva</i> (1680) und Heinrich Offelens <i>Double Grammar</i> (1687) verglichen mit Pierre Canels <i>Königlicher Teutschen Grammatic</i> (1689)","Fremdsprachenlehrwerke im 17. Jahrhundert. Beiträge zu einem Linguistic Close Reading","","","","","","2026","2026-06-09 19:12:01","2026-06-09T19:12:01Z","","229-247","","","","","","","Episteme in Bewegung","46","","","Harrassowitz","Wiesbaden","","","","","","","","","","","","","","Büchler, Liv; Simon, Horst J.","","","","","","","","","","","","","","","","","","","","","","","","","","","","","","","","","","","","","","","","","","","","",""
"P64TWPR7","bookSection","2026","Voeste, Anja","Sprachlehrwerke des 17. Jahrhunderts neu betrachtet: Eine schriftlinguistische Annäherung","Fremdsprachenlehrwerke im 17. Jahrhundert. Beiträge zu einem Linguistic Close Reading","","","","","","2026","2026-06-09 19:12:01","2026-06-09T19:12:01Z","","17-29","","","","","","","Episteme in Bewegung","46","","","Harrassowitz","Wiesbaden","","","","","","","","","","","","","","Büchler, Liv; Simon, Horst J.","","","","","","","","","","","","","","","","","","","","","","","","","","","","","","","","","","","","","","","","","","","","",""
"N37NUHNJ","bookSection","2026","Panne, Laura","Die Aussprache des Deutschen im 17. Jahrhundert nach Pierre Canel (1689) im Vergleich zu anderen Fremdsprachenlehrwerken","Fremdsprachenlehrwerke im 17. Jahrhundert. Beiträge zu einem Linguistic Close Reading","","","","","","2026","2026-06-09 19:12:01","2026-06-09T19:12:01Z","","31-48","","","","","","","Episteme in Bewegung","46","","","Harrassowitz","Wiesbaden","","","","","","","","","","","","","","Büchler, Liv; Simon, Horst J.","","","","","","","","","","","","","","","","","","","","","","","","","","","","","","","","","","","","","","","","","","","","",""
"V67ZCZY5","book","2026","","Fremdsprachenlehrwerke im 17. Jahrhundert. Beiträge zu einem Linguistic Close Reading","","978-3-447-12549-9","","10.13173/9783447125499","","","2026","2026-06-09 17:58:52","2026-06-09T17:58:52Z","","","","","","","","","Episteme in Bewegung","46","","","Harrassowitz","Wiesbaden","","","","","","","","","","","","","","Büchler, Liv; Simon, Horst J.","","","","","","","","","","","","","","","","","","","","","","","","","","","","","","","","","","","","","","","","","","","","",""
"TF8RI5X4","book","2024","","Die Sprachen der Frühen Neuzeit. Europäische und globale Perspektiven","","978-3-412-53081-5","","","","","2024","2026-06-09 17:40:09","2026-06-09T17:40:09Z","","","674","","","","","","Frühneuzeit-Impulse","6","","","Böhlau","Köln","","","","","","","","","","","","","","Häberlein, Mark; Flurschütz da Cruz, Andreas","","","","","","","","","","","","","","","","","","","","","","","","","","","","","","","","","","","","","","","","","","","","",""
"QAJ73WW2","bookSection","2026","Tsapaeva, Sabina","Das Sprachbuch des Georg von Nürnberg (1424) vs. <i>Ein Rusch Boeck</i> (16. Jh.): Was uns historische Fremdsprachenlehrwerke noch über Sprachgebrauch und Sprachidentität verraten","Sprachgebrauch und Sprachidentitäten: Variationslinguistische Perspektiven","978-3-381-13501-1 978-3-381-13502-8","","","","","2026","2026-06-09 16:54:27","2026-06-09T16:54:27Z","","37-60","","","","","","","","","","","Narr Francke Attempto","Tübingen","","","","","","K10plus ISBN","","","","","","","","Zülli, Florina; Eggenschwiler, Ronja; Dürscheid, Christa","","","","","","","","","","","","","","","","","","","","","","","","","","","","","","","","","","","","","","","","","","","","",""
"IPFSD557","journalArticle","2023","Hübner, Julia; Filatkina, Natalia","Morphosyntax als Beschreibungsgegenstand der frühneuzeitlichen Fremdsprachenlehrwerke","Jahrbuch für Germanistische Sprachgeschichte","","","https://doi.org/10.1515/jbgsg-2023-0010","https://www.degruyter.com/document/doi/10.1515/jbgsg-2023-0010/html?lang=de","","2023","2026-06-09 16:39:14","2026-06-09T16:39:14Z","","122-142","","","14","","","","","","","","","","","","","","","","","","","","","","","","","","","","","","","","","","","","","","","","","","","","","","","","","","","","","","","","","","","","","","","","","","","",""
"ACIQDKSC","bookSection","2024","Filatkina, Natalia","Sprachvermittlung und die Rolle der „Phraseologie“ in den Fremdsprachenlehrwerken aus der Frühen Neuzeit","Interkulturelles und Interdisziplinäres in der Phraseologie und Parömiologie II","978-3-339-13806-4","","","","","2024","2026-06-09 16:38:59","2026-06-09T16:38:59Z","","67-97","","","","","","","Studia Phraseologica et Paroemiologica","10","","","Dr. Kovač","Hamburg","ger","","","","","K10plus ISBN","","Meeting Name: Conference ""Intercultural and interdisciplinary in phraseology and paremiology"" Num Pages: 1","","","","","","Gondek, Anna; Jurasz, Alina; Staniewski, Przemysław; Szczęk, Joanna; Kamińska, Aleksandra","","","","","","","","","","","","","","","","","","","","","","","","","","","","","","","","","","","","","","","","","","","","",""
"P2JN8EEI","bookSection","2024","Simon, Horst J.","Sprechen lernen mit dem Auge. Intermediale Transferprozesse in Fremdsprachenlehrwerken des 17. Jahrhunderts","Logbuch Wissensgeschichte","978-3-447-12180-4","","10.13173/9783447121804.304","https://www.harrassowitz-verlag.de/isbn_9783447121804.ahtml","","2024","2026-06-09 16:37:50","2026-06-09T16:37:50Z","2024-06-10 14:17:23","304-309","","","","","","","Episteme in Bewegung","36","","","Harrassowitz","Wiesbaden","","","","","","DOI.org (Crossref)","","","","","","","","Becker-Sawatzky, Mira; Dadaş, Şirin; Eusterschulte, Anne; Hasselmann, Kristiane; Johnston, Andrew James; Quenstedt, Falk; Reufer, Claudia; Trauer, Hanna Zoe; Vogel, Christian; Wächter, Katrin; Wendt, Helge","","","","","","","","","","","","","","","","","","","","","","","","","","","","","","","","","","","","","","","","","","","","",""
"BBSAAP6U","journalArticle","2023","Ackermann, Tanja","Direktive Sprechakte in frühneuzeitlichen Fremdsprachenlehrwerken: Eine datenbasierte Evaluation von Lehrwerksdialogen als Quelle für die Historische Pragmatik","Beiträge zur Geschichte der deutschen Sprache und Literatur","","1865-9373, 0005-8076","10.1515/bgsl-2023-0002","https://www.degruyter.com/document/doi/10.1515/bgsl-2023-0002/html","Abstract                            Early Modern foreign language textbooks and especially the model dialogues that are typical of such manuals are particularly valuable sources for historical pragmatics due to the imitation of oral communication. However, the potential of this source has hardly been exploited, especially for historical speech act analysis. This study will now, first, empirically investigate the realization patterns for directive speech acts in selected model dialogues from the 16               th                to 18               th                century. Second, on the basis of the results, a data-based evaluation of the authenticity and thus the potential of language learning dialogues as a source for historical linguistics will be made.","2023","2026-06-09 16:32:30","2026-06-09T16:32:30Z","2025-08-11 14:53:57","35-79","","1","145","","","<b>Direktive Sprechakte in frühneuzeitlichen Fremdsprachenlehrwerken</b>","","","","","","","","","","","","DOI.org (Crossref)","","","","","","","","","","","","","","","","","","","","","","","","","","","","","","","","","","","","","","","","","","","","","","","","","","","","",""
"BVT6UGIW","bookSection","2025","Romstadt, Jonas; Strombach, Theresa; Weiss, Julia","„Ist das Stamm- oder quasi-Stamm-Wort ein Verbum, so wirds auf folgende Weise behandelt.“ – Passiv als fachsprachliches Merkmal von Matthias Kramer bis heute","Fach und Sprache(n)","978-3-98989-067-1","","","https://fis.uni-bamberg.de/handle/uniba/109630","","2025","2026-06-09 15:59:30","2026-06-09T15:59:30Z","2026-06-09 15:55:54","187-216","","","","","","","Schriften der Matthias-Kramer-Gesellschaft zur Erforschung der Geschichte des Fremdsprachenerwerbs und der Mehrsprachigkeit","6","","","University of Bamberg Press","Bamberg","","","","","","DOI.org (Crossref)","","","","","","","","Ammer, Jessica; Glück, Helmut; Krokowski, Tim","","","","","","","","","","","","","","","","","","","","","","","","","","","","","","","","","","","","","","","","","","","","",""
"KQYQVNY5","journalArticle","2024","Panne, Laura","Regionale Aussprachevarianten in Deutschlehrwerken des 17. Jahrhunderts","Jahrbuch für Germanistische Sprachgeschichte","","","","","","2024","2026-06-09 15:43:05","2026-06-09T15:43:05Z","","61-74","","1","15","","","","","","","","","","","","","","","","","","","","","","","","","","","","","","","","","","","","","","","","","","","","","","","","","","","","","","","","","","","","","","","","","","","",""
"URSIAZS9","bookSection","2023","Vogl, Ulrike; Kött, André","Die <i>Colloquia, et dictionariolum</i> als Beispiel für „Foreign Language Making“ in der Frühen Neuzeit","Historische Mehrsprachigkeit: europäische Perspektiven","978-3-11-133854-5","","","","","2023","2026-06-07 09:26:26","2026-06-07T09:26:26Z","","129-149","","","","","","Historische Mehrsprachigkeit","Studia Linguistica Germanica","Band 146","","","De Gruyter","Berlin, Boston","ger eng","","","","","Library of Congress ISBN","MLCM 2024/45093 (P)","","","","","","Congresses; Europe; History; Languages in contact; Multilingualism","Franceschini, Rita; Hüning, Matthias; Maitz, Péter","","","","","","","","","","","","","","","","","","","","","","","","","","","","","","","","","","","","","","","","","","","","",""
"LCRYFUPV","journalArticle","2025","Rapp, Andrea","Was folgt auf die digitale Philologie? Überlegungen zum Stand der Integration von Digitalität in die (altgermanistische) Philologie am Beispiel des Korpus der frühneuhochdeutschen Fremdsprachenlehrwerke","Mitteilungen des Deutschen Germanistenverbandes","","0418-9426, 2196-8756","https://doi.org/10.14220/mdge.2025.72.4.398","","","2025","2026-06-04 13:53:27","2026-06-04T13:53:27Z","2025-12-05 13:45:22","398-409","","4","72","","Mitteilungen des Deutschen Germanistenverbandes","Was folgt auf die digitale Philologie?","","","","","","","de","","","","","DOI.org (Crossref)","","","","","","","","","","","","","","","","","","","","","","","","","","","","","","","","","","","","","","","","","","","","","","","","","","","","",""
"PVNZHRZG","bookSection","2025","Roth, Kerstin","Einblicke in den <i>Schlueſſel zur Polniſchen und Teutſchen Sprach</i> von Jeremias Roter (1585—1630)","Identität in Sprache und Literatur: Räume und Konstellationen zwischen Schlesien und Kurpfalz","978-3-447-12431-7","","10.13173/9783447124317.019","https://www.harrassowitz-verlag.de/isbn_9783447124317.ahtml","","2025","2026-06-04 10:20:44","2026-06-04T10:20:44Z","2026-05-11 15:19:02","19-32","","","","","","","","","","","Harrassowitz","Wiesbaden","","","","","","DOI.org (Crossref)","","","","","","","","Żarski, Krzysztof; Brockstieger, Sylvia; Werle, Dirk","","","","","","","","","","","","","","","","","","","","","","","","","","","","","","","","","","","","","","","","","","","","",""
"6WL4JT9C","book","2025","Phillips, Susan E.","Learning to Talk Shop: Mercantile Mischief and Popular Pedagogy in Premodern England","","978-1-5128-2698-2","","","","""This book explores the phrasebooks and guides to conversations that flooded the marketplace in the fifteenth and sixteenth centuries, opening up a virtual classroom to an audience without access to formal education. Susan E. Phillips offers a new account of premodern education through these practical little books that offered non-elite readers lessons in navigating the premodern marketplace. Phillips looks at premodern education from a humbler perspective, focused on mercantile savvy rather than moral instruction and linguistic mastery. By expanding our archive beyond the Latin textbooks of the grammar school classroom, Phillips finds the liberatory potential in a discourse that has previously been read as upholding traditional social hierarchies in the premodern period, and uncovers a premodern pedagogy that is more expansive, flexible, and inclusive""--Publisher's description","2025","2026-06-04 09:51:20","2026-06-04T09:51:20Z","","","","","","","","Learning to Talk Shop","RaceB4Race: Critical Race Studies of the Premodern","4","","","University of Pennsylvania Press","Philadelphia","eng","","","","","K10plus ISBN","","","","","","","","","","","","","","","","","","","","","","","","","","","","","","","","","","","","","","","","","","","","","","","","","","","","",""
